{
  "$schema": "http://json-schema.org/draft-07/schema#",
  "$id": "https://ash.invalid/schemas/ash-app-1.json",
  "title": "Ash app description (ash-app/1)",
  "type": "object",
  "required": [
    "contract",
    "id",
    "name",
    "version",
    "summary",
    "publisher",
    "server"
  ],
  "additionalProperties": false,
  "properties": {
    "contract": {
      "const": "ash-app/1"
    },
    "id": {
      "type": "string",
      "pattern": "^[a-z][a-z0-9-]{0,47}$",
      "description": "Unique, lower case. Third parties prefix their publisher name, e.g. example-notes."
    },
    "name": {
      "type": "string",
      "minLength": 1,
      "maxLength": 40
    },
    "version": {
      "type": "string",
      "pattern": "^[0-9]+\\.[0-9]+\\.[0-9]+(?:[-+][0-9A-Za-z.-]+)?$"
    },
    "icon": {
      "type": "string",
      "pattern": "^[A-Za-z0-9_-][A-Za-z0-9_.-]*\\.(?:png|svg|webp)$",
      "description": "A file next to app.json."
    },
    "summary": {
      "type": "string",
      "minLength": 1,
      "maxLength": 200
    },
    "role": {
      "type": "string",
      "minLength": 1,
      "maxLength": 200,
      "description": "What this organ of ash is for and when Ash should use it, in one sentence; shown to the agent in every conversation."
    },
    "publisher": {
      "type": "string",
      "minLength": 1,
      "maxLength": 80
    },
    "server": {
      "type": "object",
      "required": [
        "command"
      ],
      "additionalProperties": false,
      "description": "The app's MCP server, started inside the container over stdio with the app's folder as working directory.",
      "properties": {
        "command": {
          "type": "string",
          "minLength": 1,
          "maxLength": 200
        },
        "args": {
          "type": "array",
          "maxItems": 32,
          "items": {
            "type": "string",
            "maxLength": 500
          }
        },
        "env": {
          "type": "object",
          "maxProperties": 32,
          "propertyNames": {
            "pattern": "^[A-Z][A-Z0-9_]{0,63}$",
            "not": {
              "pattern": "^ASH_"
            }
          },
          "additionalProperties": {
            "type": "string",
            "maxLength": 2000
          }
        }
      }
    },
    "surfaces": {
      "type": "array",
      "maxItems": 16,
      "items": {
        "type": "object",
        "required": [
          "id",
          "title",
          "resource"
        ],
        "additionalProperties": false,
        "properties": {
          "id": {
            "type": "string",
            "pattern": "^[a-z][a-z0-9-]{0,31}$"
          },
          "title": {
            "type": "string",
            "minLength": 1,
            "maxLength": 20
          },
          "resource": {
            "type": "string",
            "pattern": "^ui://[^\\s]{1,200}$"
          }
        }
      }
    },
    "events": {
      "type": "array",
      "maxItems": 32,
      "items": {
        "type": "string",
        "pattern": "^[a-z][a-z0-9_-]*(?:\\.[a-z0-9_-]+)+$",
        "not": {
          "enum": [
            "app.card",
            "app.activity"
          ]
        }
      }
    },
    "wake_events": {
      "type": "array",
      "maxItems": 32,
      "items": {
        "oneOf": [
          {
            "type": "string",
            "pattern": "^[a-z][a-z0-9_-]*(?:\\.[a-z0-9_-]+)+$"
          },
          {
            "type": "object",
            "required": [
              "event"
            ],
            "additionalProperties": false,
            "properties": {
              "event": {
                "type": "string",
                "pattern": "^[a-z][a-z0-9_-]*(?:\\.[a-z0-9_-]+)+$"
              },
              "agent": {
                "type": "string",
                "pattern": "^agent:[a-z][a-z0-9_-]{0,31}$",
                "description": "The agent to wake, as agent:<name>; leave it out to wake the primary agent."
              }
            }
          }
        ]
      },
      "description": "Events (each also in events) that should wake an agent at once rather than wait for the next conversation; a few a day at most. A plain name wakes the primary agent; {event, agent} wakes that agent."
    },
    "listens": {
      "type": "array",
      "maxItems": 32,
      "items": {
        "type": "string",
        "pattern": "^[a-z][a-z0-9_-]*(?:\\.[a-z0-9_-]+)*\\.(?:[a-z0-9_-]+|\\*)$"
      },
      "description": "Events the app wants to hear in real time, such as sense.location, or sense.* for every event under a prefix. The hub delivers each to the app's reserved tool ash.on_event {word, body, from, at}; the owner approves the list at install."
    },
    "data_dir": {
      "type": "string",
      "pattern": "^[A-Za-z0-9_-][A-Za-z0-9_.-]{0,63}$",
      "not": {
        "enum": [
          "ui",
          "node_modules"
        ]
      },
      "description": "The folder (inside the app's folder) where the app keeps the owner's data; apps.reset empties it, apps.remove {keep_data} keeps it."
    },
    "cards": {
      "type": "array",
      "maxItems": 8,
      "description": "Home-screen cards the app draws from its own data: the tool returns the card (A2UI), taps go to the action tool.",
      "items": {
        "type": "object",
        "required": [
          "id",
          "title",
          "size",
          "tool"
        ],
        "additionalProperties": false,
        "properties": {
          "id": {
            "type": "string",
            "pattern": "^[a-z][a-z0-9-]{0,14}$"
          },
          "title": {
            "type": "string",
            "minLength": 1,
            "maxLength": 40
          },
          "size": {
            "enum": [
              "2x2",
              "4x2",
              "4x4"
            ]
          },
          "tool": {
            "type": "string",
            "pattern": "^[a-z][a-z0-9_.-]{0,63}$",
            "description": "A read-only tool of this app that returns the card: {components, root?, data?, sizes?, theme?}."
          },
          "action": {
            "type": "string",
            "pattern": "^[a-z][a-z0-9_.-]{0,63}$",
            "description": "The tool a tap, toggle or choice on the card calls: {card, action, component?, item?, checked?, value?, context?}."
          },
          "refresh_min": {
            "type": "integer",
            "minimum": 5,
            "maximum": 1440,
            "description": "Redraw at least this often (minutes; default 30), besides after every change."
          }
        }
      }
    },
    "needs": {
      "type": "array",
      "maxItems": 16,
      "items": {
        "oneOf": [
          {
            "type": "object",
            "required": [
              "member",
              "words",
              "why"
            ],
            "additionalProperties": false,
            "properties": {
              "member": {
                "type": "string",
                "pattern": "^(?:device:(?:\\*|[A-Za-z0-9_-]{22})|service:[a-z][a-z0-9_-]{0,31}|agent:(?:\\*|[a-z][a-z0-9_-]{0,31})|app:[a-z][a-z0-9-]{0,47})$",
                "description": "The member to use: a service (service:llm), an agent (agent:main, or agent:* for any agent), a hand (device:<hand_id>, or device:* for any), or another app (app:<id>)."
              },
              "words": {
                "type": "array",
                "minItems": 1,
                "maxItems": 32,
                "items": {
                  "type": "string",
                  "pattern": "^[a-z][a-z0-9_.-]{0,63}$"
                }
              },
              "why": {
                "type": "string",
                "minLength": 1,
                "maxLength": 200
              }
            }
          },
          {
            "type": "object",
            "required": [
              "notify",
              "why"
            ],
            "additionalProperties": false,
            "properties": {
              "notify": {
                "const": true
              },
              "why": {
                "type": "string",
                "minLength": 1,
                "maxLength": 200
              }
            }
          },
          {
            "type": "object",
            "required": [
              "widgets",
              "why"
            ],
            "additionalProperties": false,
            "properties": {
              "widgets": {
                "const": true
              },
              "why": {
                "type": "string",
                "minLength": 1,
                "maxLength": 200
              }
            }
          },
          {
            "type": "object",
            "required": [
              "card",
              "why"
            ],
            "additionalProperties": false,
            "properties": {
              "card": {
                "const": true
              },
              "why": {
                "type": "string",
                "minLength": 1,
                "maxLength": 200
              }
            }
          },
          {
            "type": "object",
            "required": [
              "credential",
              "why"
            ],
            "additionalProperties": false,
            "properties": {
              "credential": {
                "type": "string",
                "pattern": "^[A-Za-z_][A-Za-z0-9_]{0,63}$",
                "description": "The name of a connection or key in the hub's vault (service:vault/list)."
              },
              "why": {
                "type": "string",
                "minLength": 1,
                "maxLength": 200
              }
            }
          }
        ]
      }
    }
  }
}
